Company,Valuation,Date Joined,Industry,City,Country/Region,Continent,Year Founded,Funding,Select Investors
Flipdish,$1B,1/13/22,Internet software & services,Dublin,Ireland,Europe,2015,$157M,"Tencent Holdings, Tiger Global Management, Global Founders Capital"
Honor Technology,$1B,10/5/21,Internet software & services,San Francisco,United States,North America,2014,$325M,"Andreessen Horowitz, Prosus Ventures, Thrive Capital"
Incode Technologies,$1B,12/7/21,Cybersecurity,San Francisco,United States,North America,2015,$257M,"Dila Capital, Framework Ventures, 3L"
Kuaikan Manhua,$1B,12/1/17,Internet software & services,Beijing,China,Asia,2014,$594M,"Sequoia Capital China, CMC Capital Partners, Tencent Holdings"
Marshmallow,$1B,9/8/21,Fintech,London,United Kingdom,Europe,2017,$116M,"Passion Capital, Hedosophia, Outrun Ventures"
Mythical Games,$1B,11/4/21,Internet software & services,Sherman Oaks,United States,North America,2018,$260M,"Javelin Venture Partners, Struck Capital, Alumni Ventures Group"
Route,$1B,1/21/22,"Supply chain, logistics, & delivery",Lehi,United States,North America,2018,$482M,"Madrona Venture Group, Banner Ventures, FJ Labs"
Tackle.io,$1B,12/21/21,Internet software & services,Boise,United States,North America,2016,$148M,"Andreessen Horowitz, Bessemer Venture Partners, Coatue Management"
Nexii,$1B,9/8/21,Other,Vancouver,Canada,North America,2020,$45M,"Trane Technologies, Honeywell"
GalaxySpace,$1B,11/17/20,Mobile & telecommunications,Beijing,China,Asia,2016,$14M,"Shunwei Capital Partners, 5Y Capital, Legend Capital"
Insider,$1B,2/28/22,Internet software & services,Istanbul,Turkey,Europe,2012,$167M,"Wamda Capital, Endeavor, Riverwood Capital"
Spiber,$1B,9/8/21,Other,Tsuruoka,Japan,Asia,2007,$520M,"Cool Japan Fund, JAFCO, The Carlyle Group"
Ada Support,$1B,5/7/21,Artificial intelligence,Toronto,Canada,North America,2016,$191M,"Version One Ventures, Bessemer Venture Partners, FirstMark Capital"
AgentSync,$1B,12/7/21,Fintech,Denver,United States,North America,2018,$111M,"Craft Ventures, Caffeinated Capital, Operator Collective"
Alation,$1B,6/3/21,Internet software & services,Redwood City,United States,North America,2012,$192M,"Costanoa Ventures, Data Collective, Salesforce Ventures"
BigPanda,$1B,1/12/22,Artificial intelligence,Mountain View,United States,North America,2012,$317M,"Advent International, Battery Ventures, Sequoia Capital Israel"
CarDekho,$1B,10/13/21,E-commerce & direct-to-consumer,Jaipur,India,Asia,2008,$448M,"Sequoia Capital India, Hillhouse Capital Management, Sunley House Capital Management"
Copado,$1B,9/13/21,Data management & analytics,Chicago,United States,North America,2013,$271M,"Insight Partners, Salesforce Ventures, Perpetual Investors"
DailyPay,$1B,5/18/21,Fintech,New York,United States,North America,2016,$189M,"RPM Ventures, Inspiration Ventures, Carrick Capital Partners"
FloQast,$1B,7/21/21,Fintech,Los Angeles,United States,North America,2013,$230M,"Polaris Partners, Insight Partners, Norwest Venture Partners"
Gem,$1B,9/28/21,Internet software & services,San Francisco,United States,North America,2017,$148M,"Accel, Greylock Partners, Meritech Capital Partners"
GrubMarket,$1B,9/14/21,E-commerce & direct-to-consumer,San Francisco,United States,North America,2013,$382M,"GGV Capital, BlackRock, ACE & Company"
Helium Systems,$1B,2/22/22,Internet software & services,San Francisco,United States,North America,2013,$365M,"FirstMark Capital, Tiger Global Management, FTX Venture"
Inari,$1B,5/12/21,Other,Cambridge,United States,North America,2016,$337M,"Flagship Pioneering, Alexandria Venture Investments, Investment Corporation of Dubai"
Jokr,$1B,12/2/21,E-commerce & direct-to-consumer,New York,United States,North America,2021,$430M,"GGV Capital, Tiger Global Management, Greycroft"
LivSpace,$1B,2/8/22,E-commerce & direct-to-consumer,Bengaluru,India,Asia,2015,$427M,"Jungle Ventures, Helion Venture Partners, INGKA Investments"
Merama,$1B,12/9/21,E-commerce & direct-to-consumer,Mexico City,Mexico,North America,2020,$345M,"SoftBank Latin America Fund, Advent International, Balderton Capital"
MindTickle,$1B,8/3/21,Internet software & services,San Francisco,United States,North America,2012,$281M,"Qualcomm Ventures, Accel, Canaan Partners"
MyGlamm,$1B,11/10/21,E-commerce & direct-to-consumer,Mumbai,India,Asia,2015,$310M,"L'Occitane, Trifecta Capital, Bessemer Venture Partners"
Oda,$1B,6/2/21,E-commerce & direct-to-consumer,Oslo,Norway,Europe,2013,$337M,"Kinnevik, Softbank Group, Prosus Ventures"
Offchain Labs,$1B,8/31/21,Internet software & services,Princeton,United States,North America,2018,$124M,"Pantera Capital, Polychain Capital, Lightspeed Venture Partners"
Phantom,$1B,1/31/22,Fintech,San Francisco,United States,North America,2021,$118M,"Paradigm, Andreessen Horowitz, Jump Capital"
Pilot.com,$1B,3/26/21,Fintech,San Francisco,United States,North America,2016,$161M,"Index Ventures, Sequoia Capital, Bezos Expeditions"
Prime Medicine,$1B,7/13/21,Health,Cambridge,United States,North America,2019,$315M,"Newpath Partners, Google Ventures, F-Prime Capital"
Public,$1B,2/17/21,Fintech,New York,United States,North America,2008,$309M,"Accel, Greycroft, Advancit Capital"
Qumulo,$1B,7/16/20,Data management & analytics,Seattle,United States,North America,2012,$347M,"Madrona Venture Group, Kleiner Perkins Caufield & Byers, Highland Capital Partners"
Rohlik,$1B,7/1/21,"Supply chain, logistics, & delivery",Prague,Czech Republic,Europe,2019,$380M,"Partech Partners, Index Ventures, Quadrille Capital"
SeekOut,$1B,1/12/22,Internet software & services,Bellevue,United States,North America,2017,$189M,"Mayfield, Madrona Venture Group, Tiger Global Management"
SmartMore,$1B,6/24/21,Artificial Intelligence,Shenzhen,China,Asia,2019,$300M,"IDG Capital, ZhenFund, Sequoia Capital China"
Tealium,$1B,2/3/21,Internet software & services,San Diego,United States,North America,2008,$264M,"Georgian Partners, Silver Lake, Presidio Ventures"
UpGrad,$1B,8/9/21,Edtech,Mumbai,India,Asia,2015,$194M,"Qualcomm Ventures, Accel, Canaan Partners"
Workhuman,$1B,6/23/20,Internet software & services,Dublin,Ireland,Europe,1999,$9M,ICG
Xpressbees,$1B,2/9/22,"Supply chain, logistics, & delivery",Pune,India,Asia,2012,$573M,"Norwest Venture Partners, Investcorp, Blackstone"
L&P Cosmetic,$1B,1/1/16,Consumer & retail,Seoul,South Korea,Asia,2009,$33M,CDIB Capital
Mininglamp Technology,$1B,3/27/19,Artificial intelligence,Beijing,China,Asia,2014,$787M,"Russia-China Investment Fund, Tencent Holdings, Sequoia Capital China"
Luoji Siwei,$1B,7/20/17,Edtech,Beijing,China,Asia,2012,$144M,"Sequoia Capital China, Qiming Venture Partners, Tencent Holdings"
IRL,$1B,6/15/21,Internet software & services,San Francisco,United States,North America,2017,$197M,"Goodwater Capital, Floodgate, Founders Fund"
Modern Health,$1B,2/11/21,Health,San Francisco,United States,North America,2017,$167M,"Kleiner Perkins Caufield & Byers, Afore Capital, Founders Fund"
Tuhu,$1B,9/15/18,Auto & transportation,Shanghai,China,Asia,2011,$875M,"Qiming Venture Partners, Yaxia Automobile, Far East Horizon"
CloudBees,$1B,12/9/21,Data management & analytics,San Jose,United States,North America,2010,$236M,"Matrix Partners, Lightspeed Venture Partners, Verizon Ventures"
Elemy,$1B,10/6/21,Health,San Francisco,United States,North America,2019,$323M,"General Catalyst, Bling Capital, Felicis Ventures"
Guideline,$1B,6/16/21,Fintech,San Mateo,United States,North America,2015,$339M,"Pelion Venture Partners, Foundation Capital, Thoma Bravo"
Happy Money,$1B,2/8/22,Fintech,Tustin,United States,North America,2009,$192M,"FirstMark Capital, Anthemis, CMFG Ventures"
Rebellion Defense,$1B,9/16/21,Artificial intelligence,Washington DC,United States,North America,2019,$150M,"Venrock, Innovation Endeavors, Insights Partners"
STORD,$1B,9/13/21,"Supply chain, logistics, & delivery",Atlanta,United States,North America,2015,$205M,"Dynamo VC, Susa Ventures, Founders Fund"
At-Bay,$1B,7/27/21,Fintech,Mountain View,United States,North America,2016,$292M,"Lightspeed Venture Partners, Khosla Ventures, Munich Re Ventures"
TELD,$1B,12/16/19,Fintech,Qingdao,China,Asia,2014,$396M,"China Reform Fund, Gaopeng Capital, Jinhui Xingye"
Acko General Insurance,$1B,10/28/21,Fintech,Bengaluru,India,Asia,2016,$458M,"Intact Ventures, Munich Re Ventures, General Atlantic"
apna,$1B,9/15/21,Internet software & services,Bengaluru,India,Asia,2019,$193M,"Sequoia Capital India, Rocketship.vc, Lightspeed India Partners"
Beyond Identity,$1B,2/22/22,Cybersecurity,New York,United States,North America,2019,$205M,"New Enterprise Associates, Koch Disruptive Technologies, Evolution Equity Partners"
Carousell,$1B,9/15/21,E-commerce & direct-to-consumer,,Singapore,Asia,2012,$288M,"500 Global, Rakuten Ventures, Golden Gate Ventures"
Chief,$1B,3/31/22,Other,New York,United States,North America,2019,$140M,"General Catalyst, Inspired Capital, Flybridge Capital Partners"
CoinDCX,$1B,8/10/21,Fintech,Maharashtra,India,Asia,2017,$109M,"Polychain Capital, Coinbase Ventures, Jump Capital"
Daily Harvest,$1B,11/16/21,E-commerce & direct-to-consumer,New York,United States,North America,2014,$120M,"M13, Lightspeed Venture Partners, Lone Pine Capital"
Enpal,$1B,10/18/21,Internet software & services,Berlin,Germany,Europe,2017,$304M,"HV Capital, Softbank Group, BlackRock"
eSentire,$1B,2/22/22,Cybersecurity,Waterloo,Canada,North America,2001,$186M,"Edison Partners, Georgian Partners, VentureLink"
Firefly Aerospace,$1B,5/4/21,Other,Cedar Park,United States,North America,2014,$172M,"XBTO Ventures, Raven One Ventures, SK Ventures"
Fundbox,$1B,11/30/21,Fintech,San Francisco,United States,North America,2013,$404M,"Khosla Ventures, General Catalyst, Blumberg Capital"
G2,$1B,6/22/21,Internet software & services,Chicago,United States,North America,2012,$258M,"Pritzker Group Venture Capital, Accel, Hyde Park Venture Partners"
Gaussian Robotics,$1B,11/10/21,Hardware,Shanghai,China,Asia,2013,$325M,"BlueRun Ventures, Grand Flight Investment, Meituan Dianping"
GetYourGuide,$1B,5/16/19,Travel,Berlin,Germany,Europe,2009,$656M,"Spark Capital, Highland Europe, Sunstone Capital"
GlobalBees,$1B,12/28/21,E-commerce & direct-to-consumer,New Delhi,India,Asia,2021,$185M,"Chiratae Ventures, SoftBank Group, Trifecta Capital"
Ivalua,$1B,5/21/19,Fintech,Redwood City,United States,North America,2000,$134M,"Ardian, Tiger Global Management, KKR"
Juanpi,$1B,4/14/16,E-commerce & direct-to-consumer,Wuhan,China,Asia,2012,$136M,"Tiantu Capital, SAIF Partners China, Newsion Venture Capital"
Karat,$1B,10/13/21,Internet software & services,Seattle,United States,North America,2014,$169M,"8VC, Norwest Venture Partners, Tiger Global Management"
LEAD School,$1B,1/13/22,Edtech,Andheri,India,Asia,2012,$166M,"WestBridge Capital, GSV Ventures, Elevar Equity"
Nexthink,$1B,2/8/21,Data management & analytics,Prilly,Switzerland,Europe,2004,$346M,"Auriga, Galeo Ventures, Highland Europe"
People.ai,$1B,8/11/21,Internet software & services,San Francisco,United States,North America,2017,$200M,"GGV Capital, Lightspeed Venture Partners, ICONIQ Capital"
Pharmapacks,$1B,11/12/20,E-commerce & direct-to-consumer,Islandia,United States,North America,2010,$433M,The Carlyle Group
Rightway,$1B,3/30/21,Health,New York,United States,North America,2017,$130M,"Thrive Capital, Khosla Ventures, Tiger Global Management"
Sennder,$1B,1/14/21,"Supply chain, logistics, & delivery",Berlin,Germany,Europe,2015,$340M,"Accelm Scania Growth Capital, Lakestar"
Sisense,$1B,1/9/20,Data management & analytics,New York,United States,North America,2004,$274M,"Opus Capital, Genesis Partners, Battery Ventures"
Staffbase,$1B,3/15/22,Internet software & services,Chemnitz,Germany,Europe,2014,$307M,"Insight Partners, e.ventures, General Atlantic"
Sunbit,$1B,5/20/21,Fintech,Los Angeles,United States,North America,2016,$210M,"Zeev Ventures, Group11, Chicago Ventures"
TangoMe,$1B,3/20/14,Mobile & telecommunications,Mountain View,United States,North America,2009,$361M,"Draper Fisher Jurtson, Qualcomm Ventures, Alibaba Group"
The Bank of London,$1B,11/30/21,Fintech,London,United Kingdom,Europe,2018,$90M,"Mangrove Capital Partners,14W, ForgeLight"
Zego,$1B,3/9/21,Fintech,London,United Kingdom,Europe,2016,$202M,"LocalGlobe, Balderton Capital, Target Global"
Nxin,$1B,9/18/18,Internet software & services,Beijing,China,Asia,2015,$53M,"Beijing Juneng Hesheng Industry Investment Fund, Beijing Shuju Xinrong Fund"
Mamaearth,$1B,12/28/21,E-commerce & direct-to-consumer,Gurgaon,India,Asia,2016,$111M,"Fireside Ventures, Sequoia Capital India, Stellaris Venture Partners"
Radius Payment Solutions,$1B,11/27/17,Fintech,Crewe,United Kingdom,Europe,1990,$200M,Inflexion Private Equity
Rivigo,$1B,7/11/19,"Supply chain, logistics, & delivery",Gurgaon,India,Asia,2014,$247M,"SAIF Partners India, Warburg Pincus, Trifecta Capital Advisors"
Rubicon,$1B,8/25/17,Other,Atlanta,United States,North America,2008,$223M,"Goldman Sachs, Leonardo DiCaprio, Promecap"
Socar,$1B,10/16/20,Auto & transportation,Jeju-do,South Korea,Asia,2012,$408M,"Bain Capital, Altos Ventures, Songhyun Investment"
MobileCoin,$1B,7/7/21,Fintech,San Francisco,United States,North America,2018,$107M,"General Catalyst, Future Ventures, AU21"
Density,$1B,11/10/21,Hardware,San Francisco,United States,North America,2014,$217M,"Founders Fund, Upfront Ventures, 01 Advisors"
Instabase,$1B,10/21/19,Data management & analytics,San Francisco,United States,North America,2015,$132M,"New Enterprise Associates, Greylock Partners, Andreessen Horowitz"
Jiuxian,$1B,7/30/15,E-commerce & direct-to-consumer,Beijing,China,Asia,2009,$250M,"Sequoia Capital China, Rich Land Capital, Merrysunny Wealth"
Matrixport,$1B,6/1/21,Fintech,,Singapore,Asia,2019,$100M,"Dragonfly Captial, Qiming Venture Partners, DST Global"
Mixpanel,$1B,11/15/21,Internet software & services,San Francisco,United States,North America,2009,$277M,"Bain Capital Tech Opportunities, Andreessen Horowitz, Sequoia Capital"
Sendbird,$1B,4/6/21,Mobile & telecommunications,San Mateo,United States,North America,2013,$221M,"FundersClub, Y Combinator, Tiger Global Management"
OrCam Technologies,$1B,2/20/18,Artificial intelligence,Jerusalem,Israel,Asia,2010,$86M,"Intel Capital, Aviv Venture Capital"
Leap Motor,$1B,11/20/18,Auto & transportation,Hangzhou,China,Asia,2015,$1B,"Sequoia Capital China, Gopher Asset Management, Shanghai Electric Group"
1KMXC,$1B,8/30/21,Hardware,Hangzhou,China,Asia,2014,$86M,"Goldman Sachs Asset Management, SDP Investment, Alibaba Group"
58 Daojia,$1B,10/12/15,Internet software & services,Beijing,China,Asia,2014,$300M,"KKR, Alibaba Group, Ping An Insurance"
Agile Robots,$1B,9/9/21,Hardware,Munich,Germany,Europe,2018,$240M,"Hillhouse Capital Management, Sequoia Capital China, Linear Venture"
Aibee,$1B,4/13/21,Artificial intelligence,Beijing,China,Asia,2017,$273M,"Sequoia Capital China, Lenovo Capital and Incubator, Group GSR Ventures"
Aircall,$1B,6/23/21,Internet software & services,New York,United States,North America,2014,$226M,"Balderton Capital, Next World Capital, Draper Esprit"
Ajaib,$1B,10/4/21,Fintech,Jakarta,Indonesia,Asia,2018,$245M,"Softbank Ventures Asia, Alpha JWC Ventures, Insignia Ventures Partners"
Alto Pharmacy,$1B,1/30/20,Health,San Francisco,United States,North America,2015,$524M,"Jackson Square Ventures, Greenoaks Capital Management, Softbank Group"
Amagi,$1B,3/16/22,Internet software & services,Bengaluru,India,Asia,2008,$240M,"Mayfield, Accel, Norwest Venture Partners"
Amount,$1B,5/17/21,Fintech,Chicago,United States,North America,2019,$243M,"Invus Group, Hanaco Venture Capital, WestCap Group"
Amperity,$1B,7/13/21,Artificial intelligence,Seattle,United States,North America,2016,$187M,"Madrona Venture Group, Tiger Global Management, Madera Technology Partners"
Anyscale,$1B,12/7/21,Artificial Intelligence,Berkeley,United States,North America,2019,$160M,"Andreessen Horowitz, Intel Capital, Foundation Capital"
Aptos,$1B,3/15/22,Internet software & services,Palo Alto,United States,North America,2021,$200M,"Andreessen Horowitz, Coinbase Ventures, Tiger Global Management"
Aqua Security,$1B,3/10/21,Cybersecurity,Ramat Gan,Israel,Asia,2015,$265M,"TLV Partners, Lightspeed Venture Partners, M12"
Assembly,$1B,9/21/21,Internet software & services,Culver City,United States,North America,2019,Unknown,"Advent International, PSG, Providence Equity Partners"
Assent,$1B,1/6/22,"Supply chain, logistics, & delivery",Ottawa,Canada,North America,2010,$534M,"Vista Equity Partners, Warburg Pincus, First Ascent Ventures"
Augury,$1B,10/26/21,Artificial intelligence,New York,United States,North America,2011,$294M,"Lerer Hippeau, Munich Re Ventures, Eclipse Ventures"
Axelar,$1B,2/15/22,Internet software & services,Waterloo,Canada,North America,2020,$64M,"Lemniscap VC, North Island Ventures, Polychain Capital"
Axiom Space,$1B,2/16/21,Other,Houston,United States,North America,2016,$150M,"C5 Capital, Hemisphere Ventures, The Venture Collective"
Banma Network Technologies,$1B,9/13/18,Auto & transportation,Shanghai,China,Asia,2015,$697M,"Yunfeng Capital, SDIC Innovation Investment Management, Shang Qi Capital"
BeiBei,$1B,1/22/15,E-commerce & direct-to-consumer,Hangzhou,China,Asia,2011,$224M,"Banyan Capital, New Horizon Capital, IDG Capital Partners"
BenevolentAI,$1B,6/2/15,Artificial intelligence,London,United Kingdom,Europe,2013,$292M,Woodford Investment Management
Berlin Brands Group,$1B,9/1/21,E-commerce & direct-to-consumer,Berlin,Germany,Europe,2005,$800M,"Ardian, Bain Capital"
Betterfly,$1B,2/1/22,Artificial intelligence,Santiago,Chile,South America,2018,$205M,"QED Investors, DST Global, Endeavor"
BitFury,$1B,11/6/18,Hardware,Amsterdam,Netherlands,Europe,2011,$170M,"Georgian Co-Investment Fund, iTech Capital, Galaxy Digital"
BlackBuck,$1B,7/22/21,"Supply chain, logistics, & delivery",Bengaluru,India,Asia,2015,$352M,"Accel, Sands Capital, International Finance Corporation"
Bluecore,$1B,8/5/21,Artificial intelligence,New York,United States,North America,2013,$238M,"FirstMark Capital, Georgian Partners, Norwest Venture Partners"
BlueVoyant,$1B,2/23/22,Cybersecurity,New York,United States,North America,2017,$526M,"8VC, Liberty Strategic Capital, Eden Global Partners"
bolttech,$1B,7/1/21,Fintech,,Singapore,Asia,2018,$210M,"Mundi Ventures, Doqling Capital Partners, Activant Capital"
Boom Supersonic,$1B,12/16/20,Other,Englewood,United States,North America,2014,$241M,"WRVI Capital, Caffeinated Capital, Y Combinator"
Bringg,$1B,6/16/21,"Supply chain, logistics, & delivery",Tel Aviv,Israel,Asia,2013,$185M,"Salesforce Ventures, next47, Pereg Ventures"
C2FO,$1B,8/7/19,Fintech,Leawood,United States,North America,2008,$538M,"Union Square Ventures, Summerhill Venture Partners, Mithril Capital Management"
Cadence,$1B,12/14/21,Health,New York,United States,North America,2020,$141M,"Thrive Capital, General Catalyst, Coatue Management"
CAIS,$1B,1/11/22,Fintech,New York,United States,North America,2009,$406M,"Franklin Templeton, Motive Partners, Apollo Global Management"
Cameo,$1B,3/30/21,Internet software & services,Chicago,United States,North America,2016,$165M,"Lightspeed Venture Partners, Kleiner Perkins Caufield & Byers, Origin Ventures"
Capsule,$1B,4/28/21,Health,New York,United States,North America,2016,$570M,"Thrive Capital, Durable Capital Partners, G Squared"
CargoX,$1B,10/21/21,"Supply chain, logistics, & delivery",Sao Paulo,Brazil,South America,2015,$390M,"Valor Capital Group, Lightrock, Softbank Group"
Carro,$1B,6/14/21,E-commerce & direct-to-consumer,,Singapore,Asia,2015,$595M,"SingTel Innov8, Alpha JWC Ventures, Golden Gate Ventures"
Carson Group,$1B,7/14/21,Fintech,Lincoln,United States,North America,2012,Unknown,Bain Capital
CHEQ,$1B,2/22/22,Cybersecurity,New York,United States,North America,2014,$182M,"Battery Ventures, Tiger Global Management, Hanaco Ventures"
Chronosphere,$1B,10/7/21,Data management & analytics,New York,United States,North America,2019,$254M,"Greylock Partners, Lux Capital, General Atlantic"
Cider,$1B,9/2/21,E-commerce & direct-to-consumer,,Hong Kong,Asia,2020,$140M,"Andreessen Horowitz, DST Global, IDG Capital"
Clara,$1B,12/6/21,Fintech,Mexico City,Mexico,North America,2020,$109M,"DST Global, General Catalyst, Monashees+"
Clearcover,$1B,4/13/21,Fintech,Chicago,United States,North America,2016,$305M,"American Family Ventures, Cox Enterprises, OMERS Ventures"
CommerceIQ,$1B,3/21/22,Artificial Intelligence,Palo Alto,United States,North America,2012,$196M,"Trinity Ventures, Madrona Venture Group, Shasta Ventures"
Contrast Security,$1B,11/9/21,Cybersecurity,Los Altos,United States,North America,2014,$269M,"Acero Capital, General Catalyst, M12"
Darwinbox,$1B,1/25/22,Internet software & services,Hyderabad,India,Asia,2015,$107M,"Lightspeed India Partners, Sequoia Capital India, Endiya Partners"
Dental Monitoring,$1B,10/21/21,Health,Paris,France,Europe,2014,$232M,"Vitruvian Partners, Merieux Equity Partners, Straumann"
DianRong,$1B,8/2/17,E-commerce & direct-to-consumer,Shanghai,China,Asia,2012,$549M,"Standard Chartered, FinSight Ventures, Affirma Capital"
Drata,$1B,11/8/21,Cybersecurity,San Diego,United States,North America,2020,$128M,"Cowboy Ventures, Leaders Fund, GGV Capital"
DriveNets,$1B,1/27/21,Internet software & services,Ra'anana,Israel,Asia,2015,$325M,"Bessemer Venture Partners, Pitango Venture Capital, D1 Capital Partners"
Dune Analytics,$1B,2/2/22,Data management & analytics,Oslo,Norway,Europe,2018,$79M,"Multicoin Capital, Coatue Management, Dragonfly Capital Partners"
Dxy.cn,$1B,4/10/18,Health,Hangzhou,China,Asia,2000,$682M,"Tencent Holdings, DCM Ventures"
EBANX,$1B,10/16/19,Fintech,Curitiba,Brazil,South America,2012,$460M,"FTV Capital, Endeavor"
EcoFlow,$1B,6/10/21,Hardware,Shenzhen,China,Asia,2017,$105M,"Delian Capital, China International Capital Corporation, Sequoia Capital China"
Electric,$1B,3/29/22,Cybersecurity,New York,United States,North America,2016,$209M,"Primary Venture Partners, Bessemer Venture Partners, Harmonic Growth Partners"
Emerging Markets Property Group,$1B,4/28/20,Other,Dubai,United Arab Emirates,Asia,2015,$279M,"OLX Group, KCK Group, EXOR Seeds"
Esusu,$1B,1/27/22,Fintech,New York,United States,North America,2015,$145M,"Next Play Ventures, Zeal Capital Partners, SoftBank Group"
Evidation,$1B,3/22/21,Health,San Mateo,United States,North America,2012,$259M,"B Capital Group,, GE Ventures, McKesson Ventures"
Expel,$1B,11/18/21,Cybersecurity,Herndon,United States,North America,2016,$258M,"Paladin Capital Group, Greycroft, Scale Venture Partners"
Fabric,$1B,10/26/21,"Supply chain, logistics, & delivery",New York,United States,North America,2015,$294M,"Innovation Endeavors, Aleph, Temasek"
Feedzai,$1B,3/24/21,Artificial intelligence,San Mateo,United States,North America,2009,$277M,"Global Founders Capital, Shea Ventures, Greycroft"
Fever Labs,$1B,1/26/22,Internet software & services,New York,United States,North America,2012,$299M,"Accel, 14W, GS Growth"
Fiture,$1B,4/14/21,Health,Chengdu,China,Asia,2019,$391M,"Bertelsmann Asia Investments, Sequoia Capital China, NIO Capital"
FLASH,$1B,3/16/22,Fintech,Austin,United States,North America,2011,$314M,"L Catterton, Trellis Partners, Vista Equity Partners"
Flash Express,$1B,2/1/21,"Supply chain, logistics, & delivery",Bangkok,Thailand,Asia,2017,$350M,"SCB 10X, Krungsri Finnovate, eWTP Capital"
FlashEx,$1B,8/27/18,"Supply chain, logistics, & delivery",Beijing,China,Asia,2014,$359M,"Prometheus Capital, Matrix Partners China, JD Capital Management"
Fractal Analytics,$1B,1/5/22,Data management & analytics,Mumbai,India,Asia,2000,$685M,"TPG Capital, Apax Partners, TA Associates"
Freshbooks,$1B,8/10/21,Fintech,Toronto,Canada,North America,2004,$156M,"Accomplice, Oak Investment Partners, Georgian Partners"
FXiaoKe,$1B,7/2/15,Mobile & telecommunications,Beijing,China,Asia,2011,$283M,"IDG Capital, Northern Light Venture Capital, DCM Ventures"
Gauntlet Networks,$1B,3/7/22,Fintech,New York,United States,North America,2018,$45M,"Polychain Capital, Paradigm, Ribbit Capital"
Geek+,$1B,11/21/18,Hardware,Beijing,China,Asia,2015,$439M,"Volcanics Ventures, Vertex Ventures China, Warburg Pincus"
Gelato,$1B,8/16/21,E-commerce & direct-to-consumer,Oslo,Norway,Europe,2007,$269M,"Greylock Partners, Google Ventures, BlackRock"
Glia,$1B,3/21/22,Fintech,New York,United States,North America,2012,$152M,"Wildcat Capital Management, Insight Partners, Tola Capital"
GO1,$1B,7/19/21,Internet software & services,Brisbane,Australia,Oceania,2015,$284M,"Y Combinator, M12, SEEK"
Groq,$1B,4/14/21,Artificial intelligence,Mountain View,United States,North America,2016,$362M,"TDK Ventures, Social Capital, D1 Capital Partners"
Hailo,$1B,10/12/21,Artificial intelligence,Tel Aviv,Israel,Asia,2017,$221M,"Glory Ventures, Maniv Mobility"
Haomao.AI,$1B,12/22/21,Artificial Intelligence,Beijing,China,Asia,2019,$157M,"Qualcomm Ventures, Nine Intelligence Capital, Hillhouse Capital Management"
Hasura,$1B,2/22/22,Internet software & services,Bengaluru,India,Asia,2017,$137M,"Nexus Venture Partners, Vertex Ventures, STRIVE"
HAYDON,$1B,9/24/21,Consumer & retail,Shanghai,China,Asia,2020,$100M,"Tencent Holdings, Hillhouse Capital Management"
Heyday,$1B,11/16/21,E-commerce & direct-to-consumer,Chicago,United States,North America,2017,$800M,"Khosla Ventures,General Catalyst, Victory Park Capital"
HMD Global,$1B,5/21/18,Mobile & telecommunications,Espoo,Finland,Europe,2016,$330M,Ginko Ventures
Hotmart,$1B,3/17/20,E-commerce & direct-to-consumer,Amsterdam,Netherlands,Europe,2011,$127M,"Technology Crossover Ventures, Alkeon Capital Management, General Atlantic"
Huike Group,$1B,5/24/18,Edtech,Beijing,China,Asia,2010,$302M,"Fosun RZ Capital, Oceanwide Holdings, Shenzhen Qianhe Capital Management Co."
Human Interest,$1B,8/4/21,Fintech,San Francisco,United States,North America,2015,$337M,"Wing Venture Capital, Slow Ventures, Uncork Capital"
